id,caption_number,image,caption
0,0,IMG_001.jpeg,merry christmas flower holiday winter happy celebrated
1,1,IMG_002.jpeg,love town with trees river field heartshape
2,2,IMG_003.jpeg,beach view over the window summary holiday
3,3,IMG_004.jpeg,night village with farm mice dark night
4,4,IMG_005.jpeg,old city wall crammed with old trees missing quiet empty area
5,5,IMG_006.jpeg,black cat sit on the table in the room with white flowers
6,6,IMG_007.jpeg,little bird and cute badger in the forests
7,7,IMG_008.jpeg,hot air balloon in the sky at night lonely and quiet with an ambition
8,8,IMG_009.jpeg,lonely port at sunset lighthouse waiting for people to go home
9,9,IMG_010.jpeg,children of different skin colors in the park with balloons at international festival
10,10,IMG_011.jpeg,a flog rest on the branches
11,11,IMG_012.jpeg,villages on the top snow mountain
12,12,IMG_013.jpeg,sailboat sailing freely in the sea
13,13,IMG_014.jpeg,girl sitting by the window meditating in spring
14,14,IMG_015.jpeg,swamp at sunset a row of egrets on the blue sky
15,15,IMG_016.jpeg,vibrant bird with flowers
16,16,IMG_017.jpeg,heaven and earth are wides sky over the wide land
17,17,IMG_018.jpeg,a cute bird is looking straight at you
18,18,IMG_019.jpeg,golden week holiday in Japan carp streamer fluttering in the wind
19,19,IMG_020.jpeg,Knowledge comes from books and from experience accumulation. Knowledge comes from books and from experience accumulation.
20,20,IMG_021.jpeg,a colorful bird is standing on the branche
21,21,IMG_022.jpeg,a panda is eating the banboom in the banboom forest
22,22,IMG_023.jpeg,a kid sitting the bed in the moon sky. beautiful childhood fantasy
23,23,IMG_024.jpeg,houses along the revier
24,24,IMG_025.jpeg,crystal clear water droplets fall on the leaves pring dew spring is coming soon
25,25,IMG_026.jpeg,Knowledge comes from books and from experience accumulation. Knowledge comes from books and from experience accumulation.
26,26,IMG_027.jpeg,lonely spectacular Space view of Earth from outer space
27,27,IMG_028.jpeg,sweets and dessert bring good mood
28,28,IMG_029.jpeg,colorful parrot in the woods
29,29,IMG_030.jpeg,the dog under full moon with a determined mind
30,30,IMG_031.jpeg,willow in the Chinese Garden with rockery at sunset
31,31,IMG_032.jpeg,sun scorched plains all over the mountains
32,32,IMG_033.jpeg,mermaid swims in the underwater world
33,33,IMG_034.jpeg,hedgehog enjoying garden afternoon tea
34,34,IMG_035.jpeg,office workers commutte by the train through the city
35,35,IMG_036.jpeg,glowing jellyfish in the underwater world
36,36,IMG_037.jpeg,surrounded by flowers. I look into the distance
37,37,IMG_038.jpeg,Easter elf
38,38,IMG_039.jpeg,Japanese Beauty with ancient beauty traditional costume hugging a Chow Chow dog
39,39,IMG_040.jpeg,apple pie afternoon tea
40,40,IMG_041.jpeg,sweets strawberry fruit and dessert bring good mood
41,41,IMG_042.jpeg,treasures silenced Under the Sea
42,42,IMG_043.jpeg,dolphin popping out of water
43,43,IMG_044.jpeg,the speedboat gallops breavely on the icy sea under the moonlight. ride the wind and waves
44,44,IMG_045.jpeg,tiger in the forest waiting for an opportunity
45,45,IMG_046.jpeg,playing guessing with children in summer garden
46,46,IMG_047.jpeg,heart to the sea
47,47,IMG_048.jpeg,magic color landscape
48,48,IMG_049.jpeg,Japanese shrine in the wall under the March cherry tree
49,49,IMG_050.jpeg,peacock opening screen
50,50,IMG_051.jpeg,winter solemn landscape
51,51,IMG_052.jpeg,a woman standing with a horse in field
52,52,IMG_053.jpeg,laid-back sea turtles in the underwater world with fishes
53,53,IMG_054.jpeg,underwater world jellyfish swimming towards the light with fishes
54,54,IMG_055.jpeg,post-war devastated city
55,55,IMG_056.jpeg,a cozy corner of the room and butterflies outside the window
56,56,IMG_057.jpeg,The eagle fights the sky for an ambition
57,57,IMG_058.jpeg,a cat on skateboard playing the uncontrolled game
58,58,IMG_059.jpeg,bees collecting honey on red flowers
59,59,IMG_060.jpeg,Mountains and rivers in the mysterious realm. Alien mysterious mountains and rivers
60,60,IMG_061.jpeg,The horse and the unicorn spread their wings
61,61,IMG_062.jpeg,Avatar of the goddess of Aries
62,62,IMG_063.jpeg,Japanese shrine in the heigh mountains
63,63,IMG_064.jpeg,Snow-covered trees in warm winter sun
64,64,IMG_065.jpeg,Avatar of the bird in flight
65,65,IMG_066.jpeg,Drift bottle stranded on the shore
66,66,IMG_067.jpeg,Avatar of the jumping goat
67,67,IMG_068.jpeg,rich elephant
68,68,IMG_069.jpeg,a spirited bird standing on a stone
69,69,IMG_070.jpeg,waterfall rushing down in mountains
70,70,IMG_071.jpeg,unicorn in moonlight
71,71,IMG_072.jpeg,Umbrella with flowers under spring rain
72,72,IMG_073.jpeg,Songs float in the city
73,73,IMG_074.jpeg,Mermaid playing the harp
74,74,IMG_075.jpeg,a flower as a gift
75,75,IMG_076.jpeg,cocky parrot standing on the branches
76,76,IMG_077.jpeg,Telegram to the outer planet
77,77,IMG_078.jpeg,Soaring snow mountains and reflections in water
78,78,IMG_079.jpeg,Three puppies lying together with a sandwich
79,79,IMG_080.jpeg,Badger hiding behind mushrooms at the foot of the tree
80,80,IMG_081.jpeg,Sailboat sailing towards the island at sunset
81,81,IMG_082.jpeg,Looking at the island in the sea in spring
82,82,IMG_083.jpeg,The white crane in the landscape is combing its feathers
83,83,IMG_084.jpeg,Mushrooms under the magic sky
84,84,IMG_085.jpeg,Bird family builds nest among tree branches
85,85,IMG_086.jpeg,Beach cruises and happy summer vacations
86,86,IMG_087.jpeg,Chocolate and ice cream donuts in front of the window sweets and dessert bring good mood
87,87,IMG_088.jpeg,fox wandering in the forest
88,88,IMG_089.jpeg,Clear sky and a lighthouse on calm sea
89,89,IMG_090.jpeg,Birds poking their brains on branches
90,90,IMG_091.jpeg,barren mountain at sunset
91,91,IMG_092.jpeg,white flower and beetle. The feeling of summer
92,92,IMG_093.jpeg,Living room and docile cat in the woods
93,93,IMG_094.jpeg,hot coffee and dessert bring good mood
94,94,IMG_095.jpeg,red flower
95,95,IMG_096.jpeg,Diving to explore the seabed
96,96,IMG_097.jpeg,naughty kids on april fools
97,97,IMG_098.jpeg,A big tree stands on the ground
98,98,IMG_099.jpeg,The dragonfly looks at the village in the island from the branch
99,99,IMG_100.jpeg,Flowers swaying in the wind at the foot of the village
100,100,IMG_101.jpeg,kiss under the moon surrounded by flowers
101,101,IMG_102.jpeg,waterside courtyard at sunset
102,102,IMG_103.jpeg,glacier coastline and cold sea
103,103,IMG_104.jpeg,Butterfly flying in the rice field under the dreamy starry sky
104,104,IMG_105.jpeg,The maiden and the dragon make an oath. Compassionate warm companionship
105,105,IMG_106.jpeg,A red lichen bird singing at the green willow
106,106,IMG_107.jpeg,Leopard snuggled in the arms of a girl in the forest
107,107,IMG_108.jpeg,Lively deers in the woods
108,108,IMG_109.jpeg,Domineering bird on branch
109,109,IMG_110.jpeg,Telescope night view fantasy starry sky
110,110,IMG_111.jpeg,waterside courtyard
111,111,IMG_112.jpeg,happy heart and prosperous harvest season 
112,112,IMG_113.jpeg,reflections of snow mountains and water in winter
113,113,IMG_114.jpeg,exquisite holiday
114,114,IMG_115.jpeg,Persimmon Onion Snow Peas enjoy farmhouse
115,115,IMG_116.jpeg,spring in kulu. snow melting early spring
116,116,IMG_117.jpeg,queen liberty and her bird
117,117,IMG_118.jpeg,Spread wings and fly to glory, the bird surrounded by garlands
118,118,IMG_119.jpeg,Spring River Plumbing Duck Prophet small bridge flowing water
119,119,IMG_120.jpeg,musical family
120,120,IMG_121.jpeg,spring frog flying bird with heart shape flowers
121,121,IMG_122.jpeg,two birds standing on the tree stump
122,122,IMG_123.jpeg,Family vacation on the coast
123,123,IMG_124.jpeg,clean and fresh bathroom
124,124,IMG_125.jpeg,long river sunset with mountains